{
  "$schema": "./site.schema.json",
  "updated": "2026-10-26",
  "owner": "Jordan Lee (demo)",
  "project": {
    "name": "Northwind Books",
    "title": "Northwind Atlas",
    "repo": "northwind-web",
    "team": "Storefront team",
    "eyebrow": "northwind-web · Storefront team · personal",
    "trackerName": "Linear",
    "ticketPrefix": "NB-"
  },
  "dailyLog": "notes/daily-log.md",
  "decisionsDoc": "",
  "stages": [
    "Analyse",
    "Mockup",
    "Review",
    "Plan",
    "Build",
    "PR",
    "Merged",
    "Released"
  ],
  "departments": [
    {
      "id": "storefront",
      "name": "Storefront",
      "icon": "cart",
      "pigment": "coral",
      "place": [
        1,
        1
      ],
      "status": "investigating",
      "about": "What shoppers see: home page, book pages, cart and wishlists.",
      "modules": [
        [
          "home",
          ""
        ],
        [
          "book_page",
          "investigating"
        ],
        [
          "cart",
          "investigating"
        ],
        [
          "wishlist",
          ""
        ],
        [
          "reviews",
          ""
        ],
        [
          "gift_cards",
          "investigating"
        ]
      ],
      "tickets": [
        "NB-418"
      ],
      "touched": []
    },
    {
      "id": "checkout",
      "name": "Checkout & Payments",
      "icon": "card",
      "pigment": "mint",
      "place": [
        2,
        1
      ],
      "status": "investigating",
      "about": "Paying for an order: cards, store credit, taxes and receipts.",
      "modules": [
        [
          "payments",
          "investigating"
        ],
        [
          "store_credit",
          ""
        ],
        [
          "taxes",
          ""
        ],
        [
          "receipts",
          "investigating"
        ],
        [
          "refunds",
          ""
        ]
      ],
      "tickets": [
        "NB-412",
        "NB-418"
      ],
      "touched": []
    },
    {
      "id": "catalog",
      "name": "Catalog",
      "icon": "book",
      "pigment": "honey",
      "place": [
        3,
        1
      ],
      "status": "worked",
      "about": "Books, authors, editions, prices and the bulk CSV import.",
      "modules": [
        [
          "file_import",
          "worked"
        ],
        [
          "bulk_import",
          "worked"
        ],
        [
          "editions",
          "investigating"
        ],
        [
          "authors",
          ""
        ],
        [
          "prices",
          "investigating"
        ],
        [
          "series",
          ""
        ]
      ],
      "tickets": [
        "NB-421"
      ],
      "touched": [
        {
          "ticket": "NB-421",
          "lines": [
            "app/services/catalog/file_reader.rb (new)",
            "app/jobs/catalog/read_file_job.rb (new)",
            "app/models/import_draft.rb (new)"
          ]
        }
      ]
    },
    {
      "id": "inventory",
      "name": "Warehouse & Stock",
      "icon": "boxes",
      "pigment": "sage",
      "place": [
        4,
        1
      ],
      "status": "investigating",
      "about": "Stock per warehouse, transfers between them and reorder points.",
      "modules": [
        [
          "warehouses",
          "investigating"
        ],
        [
          "stock_levels",
          ""
        ],
        [
          "transfers",
          ""
        ],
        [
          "reorder_points",
          ""
        ]
      ],
      "tickets": [
        "NB-430"
      ],
      "touched": []
    },
    {
      "id": "shipping",
      "name": "Shipping",
      "icon": "truck",
      "pigment": "peach",
      "place": [
        1,
        2
      ],
      "status": "",
      "about": "Packing slips, carriers, tracking and delivery estimates.",
      "modules": [
        [
          "packing_slips",
          ""
        ],
        [
          "carriers",
          ""
        ],
        [
          "tracking",
          ""
        ],
        [
          "delivery_estimates",
          ""
        ]
      ],
      "tickets": [],
      "touched": []
    },
    {
      "id": "admin",
      "name": "Admin & Settings",
      "icon": "sliders",
      "pigment": "ice",
      "place": [
        2,
        2
      ],
      "status": "worked",
      "about": "The back office: every settings screen a store manager configures.",
      "modules": [
        [
          "settings_catalog",
          "worked"
        ],
        [
          "settings_checkout",
          "investigating"
        ],
        [
          "settings_messages",
          "worked"
        ],
        [
          "staff",
          "investigating"
        ],
        [
          "roles",
          ""
        ]
      ],
      "tickets": [
        "NB-412",
        "NB-418",
        "NB-421",
        "NB-430"
      ],
      "touched": [
        {
          "ticket": "NB-412",
          "lines": [
            "app/views/admin/settings/messages.html.erb",
            "config/locales/admin.*.yml"
          ]
        },
        {
          "ticket": "NB-421",
          "lines": [
            "app/views/admin/catalog/imports/new.html.erb",
            "app/controllers/admin/catalog/imports_controller.rb"
          ]
        }
      ]
    },
    {
      "id": "platform",
      "name": "Platform",
      "icon": "pipes",
      "pigment": "teal",
      "place": [
        3,
        2
      ],
      "status": "worked",
      "about": "What runs underneath: background jobs, feature flags, file storage and the public API.",
      "modules": [
        [
          "background_jobs",
          "worked"
        ],
        [
          "feature_flags",
          "worked"
        ],
        [
          "file_storage",
          "worked"
        ],
        [
          "public_api",
          ""
        ],
        [
          "events",
          ""
        ]
      ],
      "tickets": [
        "NB-412",
        "NB-421"
      ],
      "touched": [
        {
          "ticket": "NB-412",
          "lines": [
            "config/feature_flags.yml: gift_message_languages"
          ]
        },
        {
          "ticket": "NB-421",
          "lines": [
            "config/storage.yml: imports bucket",
            "config/sidekiq.yml: catalog queue"
          ]
        }
      ]
    },
    {
      "id": "integrations",
      "name": "Integrations",
      "icon": "plug",
      "pigment": "sky",
      "place": [
        4,
        2
      ],
      "status": "investigating",
      "about": "Outside services: supplier feeds, marketplaces and accounting.",
      "modules": [
        [
          "supplier_feeds",
          "investigating"
        ],
        [
          "marketplaces",
          ""
        ],
        [
          "accounting_export",
          ""
        ],
        [
          "ocr_service",
          "investigating"
        ]
      ],
      "tickets": [
        "NB-421"
      ],
      "touched": []
    },
    {
      "id": "customers",
      "name": "Customers",
      "icon": "people",
      "pigment": "pink",
      "place": [
        1,
        3
      ],
      "status": "",
      "about": "Customer accounts, addresses, order history and loyalty points.",
      "modules": [
        [
          "accounts",
          ""
        ],
        [
          "addresses",
          ""
        ],
        [
          "order_history",
          ""
        ],
        [
          "loyalty",
          ""
        ]
      ],
      "tickets": [],
      "touched": []
    },
    {
      "id": "notifications",
      "name": "Notifications",
      "icon": "chat",
      "pigment": "orchid",
      "place": [
        2,
        3
      ],
      "status": "worked",
      "about": "Emails, SMS and packing-slip messages sent to shoppers.",
      "modules": [
        [
          "email_templates",
          "worked"
        ],
        [
          "sms",
          ""
        ],
        [
          "gift_messages",
          "worked"
        ],
        [
          "translations",
          "worked"
        ]
      ],
      "tickets": [
        "NB-412"
      ],
      "touched": [
        {
          "ticket": "NB-412",
          "lines": [
            "app/mailers/gift_mailer.rb",
            "app/views/gift_mailer/*.{en,de,es,ja}.html.erb"
          ]
        }
      ]
    },
    {
      "id": "auth",
      "name": "Sign-in & Roles",
      "icon": "key",
      "pigment": "sand",
      "place": [
        3,
        3
      ],
      "status": "investigating",
      "about": "Staff sign-in, roles and which warehouses each person can see.",
      "modules": [
        [
          "sessions",
          ""
        ],
        [
          "roles",
          "investigating"
        ],
        [
          "permissions",
          "investigating"
        ],
        [
          "sso",
          ""
        ]
      ],
      "tickets": [
        "NB-430"
      ],
      "touched": []
    },
    {
      "id": "reports",
      "name": "Reports",
      "icon": "chart",
      "pigment": "lilac",
      "place": [
        4,
        3
      ],
      "status": "",
      "about": "Sales, stock and bestseller reports for managers.",
      "modules": [
        [
          "sales",
          ""
        ],
        [
          "stock_report",
          ""
        ],
        [
          "bestsellers",
          ""
        ],
        [
          "exports",
          ""
        ]
      ],
      "tickets": [],
      "touched": []
    }
  ],
  "tickets": [
    {
      "id": "NB-421",
      "emoji": "📄",
      "illo": "scan",
      "illoText": "CATALOG",
      "title": "Import a catalog from a supplier PDF",
      "oneLine": "Drop in a supplier's PDF or a photo of their price list and get a review grid instead of typing a CSV.",
      "askedBy": "Priya (Catalog lead)",
      "tracker": "NB-421 · In progress",
      "status": "Build: review screen next",
      "branch": "feature/catalog-file-import",